{
  "contract_version": "delegate-eval-v1",
  "case_id": "delegate.blastradius.authz-boundary-analysis",
  "profile_id": "sol-high",
  "model": "gpt-5.6-sol",
  "effort": "high",
  "observation_date": "2026-07-22",
  "executor": {
    "name": "codex",
    "version": "codex-cli 0.144.4"
  },
  "status": "completed",
  "acceptance_results": [
    {
      "check_id": "no-repo-mutation",
      "status": "pass",
      "evidence": "git status and git diff in the seeded run directory show no change after the run."
    },
    {
      "check_id": "risk-register",
      "status": "pass",
      "evidence": "All three named risks handled concretely: revocation via credential_id/version checked before final ALLOW with revocation writes committed to the strongly consistent store before success is reported and no caller-side allow-cache initially; drift bounded by monotonic per-tenant versions, min_policy_version with INDETERMINATE(STALE_PROJECTION) on lag, and an interface-level conformance corpus with golden cases (time rules, group cycles, tenant isolation, explicit-deny precedence); audit continuity via authoritative-only canonical events in a durable outbox, decision_id dedupe, shadow results kept out of the compliance log, and an explicit rule never to rewrite existing audit IDs, retention, or order."
    },
    {
      "check_id": "rollback-path",
      "status": "pass",
      "evidence": "Cutover and rollback operate per tenant × caller type × action cohort with explicit authority flags; decision authority and audit authority flip together; the local projection is kept current throughout the rollback window and reverse-replication must be healthy before rolling back after write-ownership transfer. Emergency fail-open is confined to a break-glass procedure with a pre-approved read-only action list, short expiry, and dedicated audit events."
    }
  ],
  "measurements": {
    "wall_clock_seconds": 132,
    "tokens": {
      "input": null,
      "output": null,
      "reasoning": null
    },
    "cost": {
      "api_usd": null,
      "quota_note": "Dispatched via the codex CLI on a ChatGPT subscription; codex reported an unsplit total of 21,375 tokens used, which cannot be honestly divided into the schema's input/output/reasoning fields."
    },
    "reviewer_defects": 0,
    "followup_corrections": 0
  },
  "evidence_note": "Second observation, same UTC observation date as the first (dispatched 22:54Z; intra-date repeat). Same prompt and seeded-empty-directory setup as the first observation; memo again delivered in Korean. Distinctive depth this run: the conformance-corpus golden cases, the report-time versus view-time authorization question surfaced as a product decision, and the break-glass fallback policy. Faster and cheaper than the first sol-high observation (132s / 21,375 tokens versus 188s / 30,400). Grader found no incorrect technical claims. Raw transcript in the gitignored drafts directory (2026-07-22T22-54-26, sol-high)."
}
