{
  "contract_version": "delegate-eval-v1",
  "case_id": "delegate.blastradius.authz-boundary-analysis",
  "profile_id": "sol-xhigh",
  "model": "gpt-5.6-sol",
  "effort": "xhigh",
  "observation_date": "2026-07-22",
  "executor": {
    "name": "codex",
    "version": "codex-cli 0.144.4"
  },
  "status": "completed",
  "acceptance_results": [
    {
      "check_id": "no-repo-mutation",
      "status": "pass",
      "evidence": "git status and git diff in the seeded run directory show no change after the run; the memo itself asserts a clean work tree."
    },
    {
      "check_id": "risk-register",
      "status": "pass",
      "evidence": "All three named risks handled concretely and beyond the sol-high run's depth: token invalidation via security_epoch/jti/session checks, a signed PrincipalEnvelope replacing stored bearer tokens, minimum_security_revision demands, and the grant-versus-revoke consistency asymmetry; cross-service drift bounded by digest-pinned shadow comparison with a five-way mismatch taxonomy, stable-cohort canaries, and an explicit ban on automatic local fallback because stale local policy can resurrect revoked access; audit continuity via a shared schema introduced before cutover, producer=legacy tagging with a cutover marker, and joining decision events against caller enforcement events to detect four distinct integrity failures."
    },
    {
      "check_id": "rollback-path",
      "status": "pass",
      "evidence": "Cutover happens per stable cohort behind control-plane settings; rollback reverts a whole cohort within a validated compatibility window while local runs as reverse shadow, and automatic per-failure fallback is forbidden precisely because it would apply stale allows — keeping decisions consistent under rollback. Final local-adapter removal is gated on rollback and outage drills passing; earlier stages are additive no-ops."
    }
  ],
  "measurements": {
    "wall_clock_seconds": 251,
    "tokens": {
      "input": null,
      "output": null,
      "reasoning": null
    },
    "cost": {
      "api_usd": null,
      "quota_note": "Dispatched via the codex CLI on a ChatGPT subscription; codex reported an unsplit total of 33,215 tokens used, which cannot be honestly divided into the schema's input/output/reasoning fields."
    },
    "reviewer_defects": 0,
    "followup_corrections": 0
  },
  "evidence_note": "Bounded Batch 4 run (issue #33). Analysis-only dispatch from a seeded near-empty git directory, same prompt as sol-high. The memo (delivered in Korean despite an English prompt) is materially richer than sol-high's on the axis this pairing tests — mismatch classification, decision-versus-enforcement reconciliation, cohort canary strategy, a golden decision corpus, and an explicit failure-handling table — for 34% more wall clock and 9% more reported tokens. Grader found no incorrect technical claims; usable without follow-up correction. Raw transcript retained locally in the gitignored drafts directory (2026-07-22, sol-xhigh)."
}
